{
  "version": "1.2.0",
  "plot": { "width_m": 20.0, "depth_m": 24.0 },
  "orientation": "N",
  "footprint_target_m2": 192.0,
  "floors": 1,
  "spaces": [
    { "id": "garage",          "target_m2": 36.0, "min_w_m": 5.4, "min_h_m": 5.4, "category": "service", "tags": ["parking"] },
    { "id": "living",          "target_m2": 30.0, "min_w_m": 4.0, "min_h_m": 4.0, "category": "living",  "tags": ["social", "public"] },
    { "id": "dining",          "target_m2": 14.0, "min_w_m": 3.0, "min_h_m": 3.0, "category": "living",  "tags": ["social", "public"] },
    { "id": "kitchen_laundry", "target_m2": 20.0, "min_w_m": 4.0, "min_h_m": 4.0, "category": "service", "tags": ["wet"] },
    { "id": "master_suite",    "target_m2": 26.0, "min_w_m": 4.0, "min_h_m": 4.5, "category": "private", "tags": ["sleep", "composite"] },
    { "id": "children",        "target_m2": 28.0, "min_w_m": 3.0, "min_h_m": 6.0, "category": "private", "tags": ["sleep", "composite"] },
    { "id": "office",          "target_m2": 10.0, "min_w_m": 2.5, "min_h_m": 2.5, "category": "office",  "tags": ["work"] },
    { "id": "entry",           "target_m2": 12.0, "min_w_m": 3.0, "min_h_m": 3.0, "category": "circ",    "tags": ["composite"] }
  ],
  "adjacency": {
    "desirable": [["entry", "living"], ["entry", "office"], ["entry", "children"], ["garage", "entry"], ["kitchen_laundry", "entry"], ["children", "living"]],
    "semi": [],
    "avoid": [["master_suite", "kitchen_laundry"], ["garage", "living"]]
  }
}
